{
  "schema_version": "design-primitives/v1",
  "record_type": "design_primitives",
  "id": "swiss-deck-primitives-v1",
  "created_at": "2026-09-02",
  "source": {
    "kind": "design-system",
    "ref": "design-systems/swiss-deck",
    "tokens_ref": "design-systems/swiss-deck/design-tokens.json",
    "spec_record_id": "swiss-deck-evidence-v1"
  },
  "status": "candidate",
  "colors": [
    {
      "role": "surface",
      "value": "#f4f4f0"
    },
    {
      "role": "panel",
      "value": "#ffffff"
    },
    {
      "role": "panel_alt",
      "value": "#e9e9e2"
    },
    {
      "role": "text",
      "value": "#111111"
    },
    {
      "role": "muted",
      "value": "#5f6368"
    },
    {
      "role": "line",
      "value": "#d7d7d2"
    },
    {
      "role": "accent",
      "value": "#0047ff"
    },
    {
      "role": "accent_2",
      "value": "#d7ff00"
    }
  ],
  "color_pairings": [
    {
      "id": "accent-on-surface",
      "fg_role": "accent",
      "bg_role": "surface",
      "fg": "#0047ff",
      "bg": "#f4f4f0",
      "basis": "token-role-cooccurrence"
    },
    {
      "id": "accent-on-panel",
      "fg_role": "accent",
      "bg_role": "panel",
      "fg": "#0047ff",
      "bg": "#ffffff",
      "basis": "token-role-cooccurrence"
    },
    {
      "id": "marker-on-accent",
      "fg_role": "accent_2",
      "bg_role": "accent",
      "fg": "#d7ff00",
      "bg": "#0047ff",
      "basis": "token-role-cooccurrence"
    },
    {
      "id": "text-on-surface",
      "fg_role": "text",
      "bg_role": "surface",
      "fg": "#111111",
      "bg": "#f4f4f0",
      "basis": "token-role-cooccurrence"
    },
    {
      "id": "text-on-panel",
      "fg_role": "text",
      "bg_role": "panel",
      "fg": "#111111",
      "bg": "#ffffff",
      "basis": "token-role-cooccurrence"
    },
    {
      "id": "muted-on-surface",
      "fg_role": "muted",
      "bg_role": "surface",
      "fg": "#5f6368",
      "bg": "#f4f4f0",
      "basis": "token-role-cooccurrence"
    },
    {
      "id": "line-on-surface",
      "fg_role": "line",
      "bg_role": "surface",
      "fg": "#d7d7d2",
      "bg": "#f4f4f0",
      "basis": "token-role-cooccurrence"
    }
  ],
  "typography": {
    "display": "Inter, Helvetica, Arial, sans-serif",
    "body": "Inter, Helvetica, Arial, sans-serif",
    "mono": "JetBrains Mono, ui-monospace, SFMono-Regular, Menlo, monospace"
  },
  "spacing_scale": [
    {
      "role": "tight",
      "value": "10px",
      "px": 10
    },
    {
      "role": "gap",
      "value": "20px",
      "px": 20
    },
    {
      "role": "section",
      "value": "32px",
      "px": 32
    },
    {
      "role": "page",
      "value": "6vw",
      "px": null
    }
  ],
  "radius": {
    "default": "0px"
  },
  "structural_facts": {
    "zero_radius": true,
    "chromatic_roles": [
      "accent",
      "accent_2"
    ],
    "neutral_roles": [
      "line",
      "muted",
      "panel",
      "panel_alt",
      "surface",
      "text"
    ]
  },
  "non_claims": [
    "Values are extracted literally from the bound token source; no value is invented.",
    "color_pairings record token-role coexistence only, not verified usage in any artifact.",
    "Style tags and why-it-works judgments are NOT extracted; they require reviewer confirmation on a design-spec-record."
  ]
}
